{
  "v": "1.0",
  "owner": "u_alex",
  "local_date": "2026-10-16",
  "time_zone": "Asia/Kolkata",
  "generated_at": "2026-10-16T02:00:05.000Z",
  "trigger": "schedule",
  "model": "skipped",
  "meetings": {
    "status": "not_connected",
    "items": []
  },
  "mail_needing_reply": {
    "status": "not_connected",
    "items": []
  },
  "deadlines": {
    "status": "ok",
    "items": []
  },
  "suggestions": [],
  "todo_suggestions": []
}
